[
  {
    "runq_version": "0.1.0",
    "event_id": "evt_basic_001",
    "schema_version": "0.1.0",
    "event_type": "session.started",
    "timestamp": "2026-05-02T10:00:00.000Z",
    "session_id": "ses_basic_001",
    "run_id": "run_basic_001",
    "framework": "claude_code",
    "source": "hook",
    "privacy": {
      "level": "metadata",
      "redacted": true
    },
    "payload": {
      "agent_name": "Claude Code",
      "agent_version": "unknown"
    }
  },
  {
    "runq_version": "0.1.0",
    "event_id": "evt_basic_002",
    "schema_version": "0.1.0",
    "event_type": "user.prompt.submitted",
    "timestamp": "2026-05-02T10:00:05.000Z",
    "session_id": "ses_basic_001",
    "run_id": "run_basic_001",
    "framework": "claude_code",
    "source": "hook",
    "privacy": {
      "level": "summary",
      "redacted": true
    },
    "payload": {
      "prompt_hash": "sha256:example",
      "prompt_summary": "Add validation for RunQ events",
      "prompt_length": 36
    }
  },
  {
    "runq_version": "0.1.0",
    "event_id": "evt_basic_003",
    "schema_version": "0.1.0",
    "event_type": "file.changed",
    "timestamp": "2026-05-02T10:01:30.000Z",
    "session_id": "ses_basic_001",
    "run_id": "run_basic_001",
    "framework": "claude_code",
    "source": "hook",
    "privacy": {
      "level": "summary",
      "redacted": true
    },
    "payload": {
      "file_path_hash": "sha256:example-file",
      "file_extension": ".js",
      "change_kind": "modified",
      "lines_added": 24,
      "lines_removed": 3,
      "language": "javascript",
      "is_test_file": false
    }
  },
  {
    "runq_version": "0.1.0",
    "event_id": "evt_basic_004",
    "schema_version": "0.1.0",
    "event_type": "command.ended",
    "timestamp": "2026-05-02T10:02:00.000Z",
    "session_id": "ses_basic_001",
    "run_id": "run_basic_001",
    "framework": "claude_code",
    "source": "hook",
    "privacy": {
      "level": "metadata",
      "redacted": true
    },
    "payload": {
      "command_id": "cmd_basic_001",
      "binary": "npm",
      "exit_code": 1,
      "duration_ms": 831,
      "is_verification": true,
      "verification_kind": "test"
    }
  },
  {
    "runq_version": "0.1.0",
    "event_id": "evt_basic_005",
    "schema_version": "0.1.0",
    "event_type": "outcome.scored",
    "timestamp": "2026-05-02T10:04:30.000Z",
    "session_id": "ses_basic_001",
    "run_id": "run_basic_001",
    "framework": "claude_code",
    "source": "sdk",
    "privacy": {
      "level": "summary",
      "redacted": true
    },
    "payload": {
      "outcome_confidence": 0.28,
      "verification_coverage": 0.4,
      "rework_risk": 0.72,
      "permission_friction": 0.1,
      "loop_risk": 0.05,
      "cost_efficiency": 0.5,
      "score_version": "0.1.0",
      "evidence_event_ids": ["evt_basic_004"]
    }
  },
  {
    "runq_version": "0.1.0",
    "event_id": "evt_basic_006",
    "schema_version": "0.1.0",
    "event_type": "session.ended",
    "timestamp": "2026-05-02T10:05:00.000Z",
    "session_id": "ses_basic_001",
    "run_id": "run_basic_001",
    "framework": "claude_code",
    "source": "hook",
    "privacy": {
      "level": "metadata",
      "redacted": true
    },
    "payload": {
      "ended_reason": "completed",
      "duration_ms": 300000
    }
  }
]
